{
  "$schema": "https://json-schema.org/draft/2020-12/schema",
  "title": "S3TemplateEngine Project Config",
  "type": "object",
  "additionalProperties": false,
  "required": ["project", "environments", "variants"],
  "properties": {
    "$schema": {
      "type": "string"
    },
    "configVersion": {
      "type": "integer",
      "minimum": 1
    },
    "project": {
      "type": "object",
      "additionalProperties": false,
      "required": ["name"],
      "properties": {
        "name": {
          "type": "string",
          "pattern": "^[a-z0-9-]+$"
        },
        "displayName": {
          "type": "string"
        }
      }
    },
    "environments": {
      "type": "object",
      "additionalProperties": {
        "type": "object",
        "additionalProperties": false,
        "required": ["awsRegion", "certificateArn"],
        "properties": {
          "awsRegion": {
            "type": "string"
          },
          "stackPrefix": {
            "type": "string"
          },
          "certificateArn": {
            "type": "string"
          },
          "route53HostedZoneId": {
            "type": "string"
          }
        }
      }
    },
    "rendering": {
      "type": "object",
      "additionalProperties": false,
      "properties": {
        "minifyHtml": {
          "type": "boolean"
        },
        "renderExtensions": {
          "type": "array",
          "items": {
            "type": "string"
          }
        },
        "outputDir": {
          "type": "string"
        },
        "maxRenderDepth": {
          "type": "integer",
          "minimum": 1
        }
      }
    },
    "variants": {
      "type": "object",
      "additionalProperties": {
        "type": "object",
        "additionalProperties": false,
        "required": ["defaultLanguage", "languages"],
        "properties": {
          "sourceDir": {
            "type": "string"
          },
          "partDir": {
            "type": "string"
          },
          "defaultLanguage": {
            "type": "string"
          },
          "routing": {
            "type": "object",
            "additionalProperties": false,
            "properties": {
              "indexDocument": {
                "type": "string"
              },
              "notFoundDocument": {
                "type": "string"
              }
            }
          },
          "languages": {
            "type": "object",
            "additionalProperties": {
              "type": "object",
              "additionalProperties": false,
              "required": ["baseUrl", "cloudFrontAliases"],
              "properties": {
                "baseUrl": {
                  "type": "string"
                },
                "targetBucket": {
                  "type": "string"
                },
                "cloudFrontAliases": {
                  "type": "array",
                  "items": {
                    "type": "string"
                  },
                  "minItems": 1
                },
                "webinyLocale": {
                  "type": "string"
                }
              }
            }
          }
        }
      }
    },
    "aws": {
      "type": "object",
      "additionalProperties": false,
      "properties": {
        "codeBuckets": {
          "type": "object",
          "additionalProperties": {
            "type": "string"
          }
        },
        "dependencyStore": {
          "type": "object",
          "additionalProperties": false,
          "properties": {
            "tableName": {
              "type": "string"
            }
          }
        },
        "contentStore": {
          "type": "object",
          "additionalProperties": false,
          "properties": {
            "tableName": {
              "type": "string"
            },
            "contentIdIndexName": {
              "type": "string"
            }
          }
        },
        "invalidationStore": {
          "type": "object",
          "additionalProperties": false,
          "properties": {
            "tableName": {
              "type": "string"
            },
            "debounceSeconds": {
              "type": "integer",
              "minimum": 0
            }
          }
        },
        "lambda": {
          "type": "object",
          "additionalProperties": false,
          "properties": {
            "runtime": {
              "type": "string",
              "enum": ["nodejs22.x"]
            },
            "architecture": {
              "type": "string",
              "enum": ["arm64", "x86_64"]
            }
          }
        }
      }
    },
    "integrations": {
      "type": "object",
      "additionalProperties": false,
      "properties": {
        "webiny": {
          "type": "object",
          "additionalProperties": false,
          "properties": {
            "enabled": {
              "type": "boolean"
            },
            "sourceTableName": {
              "type": "string"
            },
            "mirrorTableName": {
              "type": "string"
            },
            "tenant": {
              "type": "string"
            },
            "relevantModels": {
              "type": "array",
              "items": {
                "type": "string"
              }
            }
          }
        }
      }
    }
  }
}
